{
  "$schema": "../../schema/component-family.meta.schema.json",
  "family": "spinner",
  "displayName": "Spinner",
  "status": "shipped",
  "summary": "Family-local loading-indicator family with a core Spinner atom, adapter-owned context wrappers, and button-loading integration built on the same atom contract.",
  "philosophy": [
    "Keep Spinner as a small loading atom that stays decorative by default and only becomes an announced status surface when product code opts in with ariaLabel.",
    "Keep the seven synced visual styles and size scale source-owned in core so React, Vue, and Svelte render the same spinner geometry and metadata.",
    "Keep ButtonSpinner and EmptyStateSpinner thin adapter-owned context wrappers rather than turning the core atom into a matrix of loading situations.",
    "Keep spinner semantics family-local and honest: the atom emits stable local metadata today, but Spinner is not part of the wave-1 central semantic registry."
  ],
  "usage": {
    "useWhen": [
      "The UI needs an indeterminate loading indicator for inline button loading, centered empty states, or standalone async feedback.",
      "The product flow already matches ButtonSpinner or EmptyStateSpinner and benefits from the wrapper defaults for size, visual treatment, and local metadata.",
      "The team wants React, Vue, and Svelte spinner behavior to stay aligned through one core SVG recipe, one preset CSS contract, and shared adapter contracts."
    ],
    "avoidWhen": [
      "The experience needs determinate progress, percentage tracking, or skeleton structure rather than an indeterminate spinner.",
      "The implementation cannot provide nearby loading text or a truthful ariaLabel when the spinner must announce status on its own.",
      "The team expects the exploratory TinoSpinner animation assets or broader semantic brand/loading taxonomies from Figma to be part of the shipped API today."
    ]
  },
  "axe": {
    "riskTier": "medium",
    "auditStatus": "first-pass-complete",
    "automationCovers": [
      "Core recipe tests for default decorative behavior, seven synced variants, size mapping, and standalone status mode.",
      "Preset CSS contract tests for light and dark indicator colors, rotation animation wiring, stationary Cross color-shift motion, and the slow-not-stop reduced-motion policy (1600ms).",
      "Expanded shared spinner contract across React and Vue for decorative default, status mode, inner SVG isolation, token size data-size attributes, and explicit decorative=true.",
      "Local context-wrapper tests and Storybook introduction/taxonomy tests in both apps."
    ],
    "manualReviewRequired": [
      "Product-level decisions about when loading is decorative versus when a spinner should expose a standalone accessible status name.",
      "Real browser and assistive-technology validation for longer loading sequences, repeated status announcements, and button-loading feel.",
      "Whether the slow-not-stop reduced-motion policy (1600ms) is sufficient for users who need full motion off in real product flows."
    ],
    "roadmapAnchors": [
      "AXE_ROADMAP.md#phase-5--add-a-first-class-accessibility-support-model",
      "AXE_ROADMAP.md#p3--follow-up-family-and-system-work"
    ],
    "notes": [
      "Spinner completed a first-pass accessibility audit focused on decorative-vs-status policy, reduced-motion expectations, and contract maturity.",
      "The family now has expanded shared contract coverage, preset CSS contract tests for reduced-motion slowdown and Cross color-shift behavior, and a dev warning for the decorative={false} without ariaLabel misuse case."
    ]
  },
  "visuals": {
    "canonicalStories": {
      "react": [
        "apps/storybook-react/src/stories/spinner/Introduction.mdx",
        "apps/storybook-react/src/stories/spinner/spinner.stories.tsx",
        "apps/storybook-react/src/stories/spinner/button-spinner.stories.tsx",
        "apps/storybook-react/src/stories/spinner/empty-state-spinner.stories.tsx"
      ],
      "vue": [
        "apps/storybook-vue/src/stories/spinner/Introduction.mdx",
        "apps/storybook-vue/src/stories/spinner/spinner.stories.ts",
        "apps/storybook-vue/src/stories/spinner/button-spinner.stories.ts",
        "apps/storybook-vue/src/stories/spinner/empty-state-spinner.stories.ts"
      ],
      "svelte": [
        "apps/storybook-svelte/src/stories/spinner/Introduction.mdx",
        "apps/storybook-svelte/src/stories/spinner/spinner.stories.ts",
        "apps/storybook-svelte/src/stories/spinner/button-spinner.stories.ts",
        "apps/storybook-svelte/src/stories/spinner/empty-state-spinner.stories.ts"
      ]
    },
    "preferredStates": [
      "classic",
      "ring",
      "dual",
      "dots-round",
      "dots-square",
      "lines",
      "cross",
      "xs",
      "sm",
      "md",
      "lg",
      "button-loading",
      "empty-state",
      "light",
      "dark"
    ]
  },
  "openQuestions": [
    "Which Spinner-family stories should join the first automated accessibility smoke set?",
    "Should Spinner eventually gain a clearer documented policy for when product teams should pair it with surrounding loading text versus using ariaLabel directly?",
    "Should the exploratory TinoSpinner size and animation assets remain design-only references, or should any of that surface become a future shipped spinner API?"
  ]
}
